<?xml version="1.0" encoding="UTF-8" ?>

<!DOCTYPE easy-chess SYSTEM "easychess.dtd">
<easy-chess>

  <player ssn="Ssn1">
    <first-name>Stacy</first-name>
    <last-name>Waller</last-name>
    <elo-ranking>1700</elo-ranking>
  </player>

  <player ssn="Ssn2">
    <first-name>Hashir</first-name>
    <last-name>Avila</last-name>
    <elo-ranking>1800</elo-ranking>
  </player>

  <player ssn="Ssn3">
    <first-name>Lucas</first-name>
    <last-name>Horner</last-name>
    <elo-ranking>1654</elo-ranking>
  </player>

  <player ssn="Ssn4">
    <first-name>Sienna</first-name>
    <last-name>Hart</last-name>
    <elo-ranking>1864</elo-ranking>
  </player>

  <tournament winner="Team1">

    <team id="Team1">
      <teammate person="Ssn1"/>
      <teammate person="Ssn2"/>
    </team>

    <team id="Team2">
      <teammate person="Ssn3"/>
      <teammate person="Ssn4"/>
    </team>

    <game
      team-one="Team2"
      team-one-score="1"
      team-two="Team2"
      team-two-score="1">

      <date hour="14:05" day="01" month="jan" year="2020"/>

      <referee>
        <first-name>Maria</first-name>
        <last-name>Wills</last-name>
      </referee>

      <moves>
        <move type="pawn" board="A">
          <cell x="A" y="3"/>
        </move>
        <move type="pawn" accouncement="check" takes="pawn" board="B">
          <cell x="A" y="5"/>
        </move>
        <castling type="big" board="B">
          <cell x="B" y="4"/>
        </castling>
      </moves>

    </game>

  </tournament>

</easy-chess>